{
  "$schema":"https://json-schema.org/draft/2020-12/schema","title":"CXO Ecosystem relationship schema 1.0.0","type":"object",
  "required":["id","subject_entity_id","predicate","object_entity_id","status","verification_status","confidence","source_ids"],
  "properties":{"id":{"type":"string"},"subject_entity_id":{"type":"string"},"predicate":{"enum":["parent_of","subsidiary_of","has_division","division_of","acquired","acquired_by","funded_by","invested_in","integrates_with","partner_of","member_of","advised_by","sponsor_of"]},"object_entity_id":{"type":"string"},"status":{"enum":["current","historical"]},"valid_from":{"type":["string","null"],"format":"date"},"valid_to":{"type":["string","null"],"format":"date"},"as_of_date":{"type":["string","null"],"format":"date"},"verification_status":{"enum":["verified","high confidence","medium confidence","conflicting"]},"confidence":{"enum":["high","medium","low"]},"source_ids":{"type":"array","minItems":1,"uniqueItems":true,"items":{"type":"string"}},"notes":{"type":["string","null"]}}
}
